topic,topic_words,tahun,count
86,"silica, bacteria, aerogel, zeolite, sand",2019-10-20 16:00:00,11
87,"silica, digital, literasi, immigrants, intergrated",2019-10-20 16:00:00,13
88,"digital, motivation, bored, literacy, pasch",2019-10-20 16:00:00,16
89,"jordanian, motivasi, social, view, twitter",2019-10-20 16:00:00,11
90,"social, media, tokoh, jewel, ein",2019-10-20 16:00:00,14
91,"aedes, cumini, jamblang, aegypti, larva",2019-10-20 16:00:00,7
92,"kinematics, understanding, impuls, rotational, force",2019-10-20 16:00:00,13
93,"kesenian, understanding, motion, kinematics, conceptual",2019-10-20 16:00:00,18
94,"sub, peo, ferrofluids, antibacterial, dmso",2019-10-20 16:00:00,22
95,"sub, ferrofluids, antibacterial, nelayan, dmso",2019-10-20 16:00:00,18
96,"ibu, nelayan, mkjp, fishing, contraception",2019-10-20 16:00:00,19
97,"ctpnp, phenomena, nonlinear, conference, theoretical",2019-10-20 16:00:00,7
98,"sharia, islamic, banks, quantum, syariah",2019-10-20 16:00:00,21
99,"multimedia, interaktif, unsur, sharia, syariah",2019-10-20 16:00:00,19
100,"multimedia, law, interaktif, amendment, legalisasi",2019-10-20 16:00:00,4
101,"manajemen, filsafat, ilmu, untaian, hukum",2019-10-20 16:00:00,16
102,"fuzzy, logic, mamdani, kuat, manajemen",2019-10-20 16:00:00,12
103,"fuzzy, economics, caring, logic, economic",2019-10-20 16:00:00,17
104,"kotoran, economics, pupuk, pembuatan, kompos",2019-10-20 16:00:00,17
105,"moral, debate, kotoran, sapi, motivational",2019-10-20 16:00:00,17
106,"counseling, moral, user, eligibility, kipas",2019-10-20 16:00:00,10
107,"counseling, counselor, hardness, quenching, brass",2019-10-20 16:00:00,8
108,"complying, serpong, casting, envelope, tall",2019-10-20 16:00:00,8
109,"heat, kalor, temperature, suhu, conceptual",2019-10-20 16:00:00,18
110,"fly, ash, kalor, suhu, heat",2019-10-20 16:00:00,8
111,"ash, petani, fly, pertanian, poncokusumo",2019-10-20 16:00:00,11
112,"tribe, traditional, medicine, plants, dayak",2019-10-20 16:00:00,10
113,"clean, semiring, roots, ring, matrices",2019-10-20 16:00:00,7
114,"clean, ring, taiwan, outpatient, hospital",2019-10-20 16:00:00,12
115,"sensitized, dye, solar, patient, zwitterion",2019-10-20 16:00:00,8
116,"tempeh, streptozotocin, potato, sweet, purple",2019-10-20 16:00:00,2
117,"rat, streptozotocin, tradisi, makna, purple",2019-10-20 16:00:00,18
118,"tulangan, rod, threaded, pull, glued",2019-10-20 16:00:00,6
119,"obese, exercise, bamboo, females, continuous",2019-10-20 16:00:00,10
120,"blended, obese, exercise, appeal, 365",2019-10-20 16:00:00,9
121,"thin, microstructural, film, blended, snse0",2019-10-20 16:00:00,6
123,"photocatalytic, polyoxometalate, keggin, remediation, hydrogen",2019-10-20 16:00:00,3
124,"bacterial, cellulose, films, photocatalytic, nanoplatelets",2019-10-20 16:00:00,7
125,"bacterial, cellulose, jalan, membrane, nanocellulose",2019-10-20 16:00:00,16
126,"road, sampah, jalan, waste, bersih",2019-10-20 16:00:00,11
127,"elektromekanik, titl, listrik, sampah, instalasi",2019-10-20 16:00:00,8
128,"biocomposite, pineapple, cellulose, starch, biofilm",2019-10-20 16:00:00,5
129,"pernikahan, pineapple, starch, cellulose, tapan",2019-10-20 16:00:00,9
130,"pandemi, marriage, covid, 19, pernikahan",2019-10-20 16:00:00,18
131,"pandemi, derivatives, antibacterial, linn, covid",2019-10-20 16:00:00,6
132,"map, build, concept, extended, kit",2019-10-20 16:00:00,16
133,"concept, map, build, fashion, extended",2019-10-20 16:00:00,12
134,"graded, concrete, ratio, fashion, reinforcement",2019-10-20 16:00:00,12
135,"graded, concrete, beams, ratio, reinforcement",2019-10-20 16:00:00,10
136,"inquiry, guided, oriented, kelarutan, metakognitif",2019-10-20 16:00:00,10
137,"inquiry, guided, tumbuhan, oriented, mgmp",2019-10-20 16:00:00,10
138,"diabetes, mellitus, plant, dm, melitus",2019-10-20 16:00:00,11
139,"diabetes, mellitus, satisfaction, administrative, lecture",2019-10-20 16:00:00,17
140,"satisfaction, institutions, rokok, merokok, tobacco",2019-10-20 16:00:00,8
141,"emotion, smoking, classification, intelligence, detection",2019-10-20 16:00:00,6
142,"halal, emotion, face, recognition, guarantee",2019-10-20 16:00:00,18
143,"halal, dose, miky, aib, syu",2019-10-20 16:00:00,8
144,"kisi, tier, miskonsepsi, monitoring, tes",2019-10-20 16:00:00,8
145,"neutron, stars, instrumen, tier, rapidly",2019-10-20 16:00:00,11
146,"ikhtiar, konjungsi, korpus, bahasa, musyawarah",2019-10-20 16:00:00,6
147,"bakar, language, introducing, sepeda, fuel",2019-10-20 16:00:00,8
148,"konsumsi, economic, intensitas, literacy, perilaku",2019-10-20 16:00:00,9
149,"mice, konsumsi, cells, ekonomi, fat",2019-10-20 16:00:00,10
150,"corporate, responsibility, csr, mice, perusahaan",2019-10-20 16:00:00,7
151,"caco3, responsibility, corporate, fulica, achatina",2019-10-20 16:00:00,5
152,"turbine, caco3, calcium, computational, fluid",2019-10-20 16:00:00,7
153,"sepakbola, turbine, pemain, sepak, bola",2019-10-20 16:00:00,13
154,"hbv, sepakbola, mutation, hepatocellular, betatrophin",2019-10-20 16:00:00,7
155,"asphalt, marshall, wearing, betatrophin, metabolic",2019-10-20 16:00:00,8
156,"asphalt, video, wearing, marshall, concrete",2019-10-20 16:00:00,7
157,"video, disability, delay, junrejo, intellectual",2019-10-20 16:00:00,9
158,"2020, 2019, semester, 2018, genap",2019-10-20 16:00:00,14
159,"mips, molecularly, phenol, detecting, paste",2019-10-20 16:00:00,1
160,"supervision, collegial, ionic, polymer, approaches",2019-10-20 16:00:00,10
161,"supervision, penulisan, ilmiah, guru, artikel",2019-10-20 16:00:00,16
163,"project, selpi, lean, startup, improvement",2019-10-20 16:00:00,5
164,"contingent, scaffolding, project, cmooc, pembelajarn",2019-10-20 16:00:00,5
165,"scaffolding, fraction, seventh, layers, sense",2019-10-20 16:00:00,7
166,"backpropagation, ann, fractions, fraction, visitors",2019-10-20 16:00:00,7
167,"proficiency, esai, across, authentic, writing",2019-10-20 16:00:00,6
168,"tournament, teams, tgt, games, menulis",2019-10-20 16:00:00,12
169,"tournament, order, teams, games, tgt",2019-10-20 16:00:00,12
170,"life, order, higher, disruptive, thinking",2019-10-20 16:00:00,8
171,"life, anaerobic, spinach, krebet, phytoremediation",2019-10-20 16:00:00,7
172,"ekonomi, kek, pillar, efisiens, adroid",2019-10-20 16:00:00,5
173,"pedagogical, content, technological, knowledge, knowladge",2019-10-20 16:00:00,8
174,"pedagogical, technological, content, pacet, wenner",2019-10-20 16:00:00,4
175,"pottery, craft, landslide, ceramic, souvenir",2019-10-20 16:00:00,6
176,"pbinagd, amplification, optical, spectroscopy, glass",2019-10-20 16:00:00,3
177,"glasses, bank, nmr, inf, gel",2019-10-20 16:00:00,9
178,"comedy, komik, comica, macots, apersepsi",2019-10-20 16:00:00,7
179,"ovop, virtual, disrupsi, electronics, analog",2019-10-20 16:00:00,3
180,"filsafat, aristotle, virtual, mozaik, bookchapter",2019-10-20 16:00:00,5
181,"simplicia, decoction, balb, kaempferia, pandurata",2019-10-20 16:00:00,6
182,"newton, laws, law, epistemic, hukum",2019-10-20 16:00:00,11
183,"newton, laws, kelud, bencana, hukum",2019-10-20 16:00:00,4
184,"self, regulation, studentsessay, qur, regulated",2019-10-20 16:00:00,8
185,"obesitas, self, regulated, kejadian, kanjuruhan",2019-10-20 16:00:00,6
186,"perovskite, ambient, obesitas, solar, lead",2019-10-20 16:00:00,5
187,"returns, perovskite, evidence, solar, austra",2019-10-20 16:00:00,4
188,"validating, infections, questionnaire, rasch, prevention",2019-10-20 16:00:00,5
189,"weathering, rock, susceptibility, andesite, magnetic",2019-10-20 16:00:00,5
190,"backhoe, equipment, susceptibility, magnetic, co2",2019-10-20 16:00:00,6
191,"ii, nanomagnetite, carboxymethyl, kappa, preconcentration",2019-10-20 16:00:00,9
192,"turbine, wind, ii, nanomagnetite, torque",2019-10-20 16:00:00,9
194,"critical, silver, problem, thinking, retention",2019-10-20 16:00:00,11
195,"instagram, critical, freshmen, durenan, mengoptimalkan",2019-10-20 16:00:00,4
196,"instagram, failure, rod, connecting, finite",2019-10-20 16:00:00,5
197,"bullying, finite, element, failure, mencegah",2019-10-20 16:00:00,8
198,"bullying, speaking, australasian, parliamentary, fluency",2019-10-20 16:00:00,5
199,"bulb, sativum, allium, inhibit, speaking",2019-10-20 16:00:00,3
200,"heat, exchanger, nanofluid, transfer, flowrate",2019-10-20 16:00:00,2
201,"heat, exchanger, nanofluid, transfer, tube",2019-10-20 16:00:00,12
202,"phylogenetic, varingifolium, margaritacea, manggabai, oratorius",2019-10-20 16:00:00,6
203,"science, socio, issues, scientific, survey",2019-10-20 16:00:00,11
204,"science, al, socio, issues, survey",2019-10-20 16:00:00,13
205,"al, pendidikan, tinjauan, meneropong, pembiayaannya",2019-10-20 16:00:00,6
206,"proyek, pendidikan, konstruksi, tuntutan, pekerjaan",2019-10-20 16:00:00,12
207,"administrasi, scorecards, tas, accelerate, reviewed",2019-10-20 16:00:00,5
208,"inklusi, landasan, sekolah, administrasi, manajemen",2019-10-20 16:00:00,10
209,"inklusi, georadar, dam, geolistrik, dipole",2019-10-20 16:00:00,4
210,"nanolayers, hexaferrite, barium, microwave, absorption",2019-10-20 16:00:00,1
211,"soybean, microwave, lines, absorption, characters",2019-10-20 16:00:00,6
212,"soybean, lines, desa, informasi, gondosuli",2019-10-20 16:00:00,11
213,"jejak, budaya, suberdaya, dachl, jendela",2019-10-20 16:00:00,6
214,"buah, pisang, lokal, keprok, gunting",2019-10-20 16:00:00,10
215,"colony, bee, artificial, sizing, svc",2019-10-20 16:00:00,3
216,"bee, listening, clil, colony, audio",2019-10-20 16:00:00,5
217,"listening, tuberkulosis, kejadian, puskesmas, pneumonia",2019-10-20 16:00:00,6
218,"reduced, graphene, pneumonia, polyaniline, conductivity",2019-10-20 16:00:00,5
219,"graphene, semakin, conductivity, tcp, reduced",2019-10-20 16:00:00,6
220,"cr2o3and, ni2, anode, potassium, battery",2019-10-20 16:00:00,1
221,"virtual, lithium, reality, ion, batteries",2019-10-20 16:00:00,6
222,"stress, virtual, coping, reality, berfokus",2019-10-20 16:00:00,4
223,"share, pair, think, stres, berwawancara",2019-10-20 16:00:00,4
224,"share, pair, think, photodegradation, fe3o4",2019-10-20 16:00:00,8
226,"thunderstorm, dance, tari, pucangan, instruksional",2019-10-20 16:00:00,4
227,"opinion, competence, storytelling, pop, personal",2019-10-20 16:00:00,2
228,"dengue, literacy, critical, ns5, media",2019-10-20 16:00:00,8
229,"dengue, child, fever, mother, nutrition",2019-10-20 16:00:00,5
230,"distance, child, stunting, anthropometry, displacement",2019-10-20 16:00:00,9
231,"distance, setempat, dinamika, adanya, desktop",2019-10-20 16:00:00,8
232,"resilience, academic, scale, sprawl, suburb",2019-10-20 16:00:00,10
233,"resilience, membranes, pewarna, polietylene, tripolyphosphate",2019-10-20 16:00:00,3
234,"photogrammetry, reconstruction, 3d, surface, application",2019-10-20 16:00:00,1
235,"3d, printed, part, keselamatan, kerja",2019-10-20 16:00:00,11
236,"mangrove, cengkrong, keselamatan, hutan, sovenir",2019-10-20 16:00:00,5
237,"mangrove, lulusan, entering, conformity, majors",2019-10-20 16:00:00,7
238,"pjbl, stem, project, vocational, wbl",2019-10-20 16:00:00,7
239,"pjbl, rantau, olahragawan, project, being",2019-10-20 16:00:00,5
240,"being, well, caregivers, patients, vascular",2019-10-20 16:00:00,5
241,"gelombang, isomorfik, dementia, butir, patients",2019-10-20 16:00:00,6
242,"grammarly, cohorts, srw, awe, expository",2019-10-20 16:00:00,2
243,"writing, elektronis, efl, sumber, indonesian",2019-10-20 16:00:00,8
245,"sensor, cp, triangular, bragg, sar",2019-10-20 16:00:00,5
246,"freeport, antenna, amount, remittance, worker",2019-10-20 16:00:00,2
247,"epiphytic, ferns, soerjo, host, migran",2019-10-20 16:00:00,3
248,"erosivity, rainfall, bengkulu, watershed, temporal",2019-10-20 16:00:00,3
249,"breastfeeding, exclusive, rainfall, watershed, brantas",2019-10-20 16:00:00,7
250,"breastfeeding, exclusive, ingat, fenotipik, reka",2019-10-20 16:00:00,5
251,"radar, nanocomposites, sand, pani, absorption",2019-10-20 16:00:00,3
252,"radar, absorbing, halaqoh, publika, mpi",2019-10-20 16:00:00,4
253,"collembola, land, forest, unburn, burnt",2019-10-20 16:00:00,4
254,"rice, gene, varieties, oryza, land",2019-10-20 16:00:00,8
255,"5e, redox, rice, laju, gene",2019-10-20 16:00:00,10
256,"5e, spray, steel, stainless, coating",2019-10-20 16:00:00,3
257,"fpb, funmath, matematika, kpk, microblogging",2019-10-20 16:00:00,4
259,"salmon, tracking, multimedia, artificial, adherencing",2019-10-20 16:00:00,6
260,"oleifera, fibrogenesis, attenuate, moringa, powder",2019-10-20 16:00:00,3
261,"articulate, storyline, aplikasi, perangkat, lempar",2019-10-20 16:00:00,9
262,"articulate, storyline, organik, tangga, sampah",2019-10-20 16:00:00,9
263,"optik, cahaya, organik, alat, tangga",2019-10-20 16:00:00,6
264,"roof, optik, tular, gethok, principals",2019-10-20 16:00:00,6
265,"pajak, wpop, penggelapan, realisasi, wajib",2019-10-20 16:00:00,2
266,"picture, narrative, series, text, speaking",2019-10-20 16:00:00,1
267,"larva, strains, adult, melanogaster, drosophila",2019-10-20 16:00:00,1
268,"drosophila, melanogaster, lead, strains, climbing",2019-10-20 16:00:00,7
269,"beton, balok, lentur, gradasi, serat",2019-10-20 16:00:00,7
270,"beton, pirposal, excretory, balok, lentur",2019-10-20 16:00:00,9
271,"compactness, completeness, fourier, metric, spaces",2019-10-20 16:00:00,2
272,"fragility, osmotic, erythrocyte, amount, mda",2019-10-20 16:00:00,1
273,"gemeente, 1947, bupati, kawedanan, pemberlakukan",2019-10-20 16:00:00,3
274,"curry, chicken, soup, bowl, meatball",2019-10-20 16:00:00,2
275,"intelligence, artificial, smart, intelligent, courses",2019-10-20 16:00:00,3
276,"newspaper, intelligence, artificial, journalism, jurnalistik",2019-10-20 16:00:00,7
277,"moodle, subjects, mkdk, learn, newspaper",2019-10-20 16:00:00,8
278,"moodle, subjects, aids, hiv, epidemi",2019-10-20 16:00:00,7
279,"barr, epstein, dehydroevodiamine, virus, protease",2019-10-20 16:00:00,1
280,"musik, musikal, molecular, banjari, beats",2019-10-20 16:00:00,5
281,"music, spends, expenditures, ageing, coronary",2019-10-20 16:00:00,3
282,"burr, hip, comparation, ti6al4v, quenching",2019-10-20 16:00:00,3
283,"inclination, radiation, collector, plate, flat",2019-10-20 16:00:00,1
284,"bank, tbk, photovoltaic, collector, thermal",2019-10-20 16:00:00,9
285,"facilitate, seamless, formal, informal, bank",2019-10-20 16:00:00,1
286,"tematik, village, dasar, bermakna, kontekstual",2019-10-20 16:00:00,6
287,"scaffold, porosity, nanofiber, village, cs",2019-10-20 16:00:00,5
288,"geogebra, nvivo, inteligent, triangulasi, nanofiber",2019-10-20 16:00:00,4
289,"german, geogebra, welcoming, language, policy",2019-10-20 16:00:00,6
290,"german, green, intan, lifestyl, repurchase",2019-10-20 16:00:00,4
291,"green, 2d, animation, camlearn, respirasi",2019-10-20 16:00:00,5
292,"madrasah, animation, aliyah, antikorupsi, attaraqqie",2019-10-20 16:00:00,8
293,"flash, flashdengan, madrasah, cs6, macromedia",2019-10-20 16:00:00,3
294,"marah, emotional, flash, mengelola, emosi",2019-10-20 16:00:00,2
295,"implant, dental, eggshell, chicken, hydroxyapatite",2019-10-20 16:00:00,1
296,"abuse, sexual, protection, redayaku, related",2019-10-20 16:00:00,3
0,"problems, mathematics, menyelesaikan, matematika, solving",2021-02-06 12:00:00,40
1,"call, problems, mathematical, solving, mathematics",2021-02-06 12:00:00,17
2,"power, indonesian, photovoltaic, circuit, bahasa",2021-02-06 12:00:00,27
3,"tourism, power, ecotourism, regency, cave",2021-02-06 12:00:00,39
4,"chemistry, tourism, conceptos, pictorial, de",2021-02-06 12:00:00,12
5,"environmental, chemistry, conservation, theme, science",2021-02-06 12:00:00,20
6,"abi2ta2o9aurivillius, annealed, co3o4, stirring, auto",2021-02-06 12:00:00,4
7,"entrepreneurship, entrepreneurial, mediating, linkage, inf",2021-02-06 12:00:00,14
8,"entrepreneurial, pandemic, entrepreneurship, 19, covid",2021-02-06 12:00:00,42
9,"pandemic, cipp, covid, 19, vocational",2021-02-06 12:00:00,13
10,"biology, giresimco, tutoring, scaffold, revealing",2021-02-06 12:00:00,6
11,"biology, flour, noodles, proximate, glycosylation",2021-02-06 12:00:00,6
12,"brand, marketing, penjualan, purchase, umkm",2021-02-06 12:00:00,13
13,"reading, baca, literasi, membaca, proficiency",2021-02-06 12:00:00,17
14,"reading, android, mobile, 7e, colligative",2021-02-06 12:00:00,18
15,"android, mobile, athletes, pasi, instrumental",2021-02-06 12:00:00,20
16,"islamic, muslim, athletes, values, shihab",2021-02-06 12:00:00,12
17,"beginners, penjas, pigp, efisien, pamong",2021-02-06 12:00:00,3
18,"ngijo, ibuku, parent, toga, mothers",2021-02-06 12:00:00,9
19,"kepemimpinan, kepala, leadership, officer, principal",2021-02-06 12:00:00,9
20,"leadership, kepemimpinan, organizational, kepala, job",2021-02-06 12:00:00,15
21,"game, remo, tingkatkebugaran, wordwall, protracted",2021-02-06 12:00:00,11
22,"slam, robot, game, qibla, prayer",2021-02-06 12:00:00,6
23,"augmented, reality, robot, bangun, chinese",2021-02-06 12:00:00,17
24,"augmented, reality, online, mining, anxieties",2021-02-06 12:00:00,12
25,"sports, physical, online, publication, timeline",2021-02-06 12:00:00,20
26,"character, lost, inte, found, cultivation",2021-02-06 12:00:00,6
27,"odd, labeling, snake, graphs, amalgamation",2021-02-06 12:00:00,15
28,"graphs, gender, zahrana, habiburrahman, join",2021-02-06 12:00:00,5
29,"arabic, arab, actfl, gender, women",2021-02-06 12:00:00,12
30,"nitrile, arabic, arab, phenylpropenoids, isomerization",2021-02-06 12:00:00,6
31,"geography, geografi, complex, silver, spatial",2021-02-06 12:00:00,11
32,"firm, geography, geografi, stock, spatial",2021-02-06 12:00:00,12
33,"screencast, akuntansi, presentasi, sma, dasar",2021-02-06 12:00:00,2
34,"akuntansi, accounting, hydrogenation, furfuryl, furfural",2021-02-06 12:00:00,7
35,"numeration, critical, disposition, mastering, mipa",2021-02-06 12:00:00,4
36,"german, critical, jerman, cefr, thinking",2021-02-06 12:00:00,9
37,"inclusive, special, kyai, gaps, jerman",2021-02-06 12:00:00,5
38,"fisika, lanjut, kuantitatif, experiment, physics",2021-02-06 12:00:00,3
39,"ham, fisika, lalu, physics, political",2021-02-06 12:00:00,8
40,"ketimpangan, pendapatan, household, regression, regional",2021-02-06 12:00:00,5
41,"masonry, 030014, 2489, 2022, 0095253",2021-02-06 12:00:00,4
42,"jitsi, lca, bangunan, usefulness, mekatronika",2021-02-06 12:00:00,9
43,"biomechanical, berplatform, enhance, complexity, problem",2021-02-06 12:00:00,6
44,"bunisa, kersosmi, siniar, problem, gelar",2021-02-06 12:00:00,8
45,"supercapacitor, symmetric, activated, biomass, tio2nanocomposites",2021-02-06 12:00:00,3
46,"medical, health, sharpening, rsia, currently",2021-02-06 12:00:00,7
47,"financial, mileneals, circulates, sasak, old",2021-02-06 12:00:00,4
48,"static, fluid, undestanding, resitation, conceptual",2021-02-06 12:00:00,3
49,"1560, tikaf, ilahi, jalaluddin, akbar",2021-02-06 12:00:00,2
50,"koperasi, cooperative, she, meningkatan, tkro",2021-02-06 12:00:00,7
51,"oil, kooperatif, transesterification, methyl, palm",2021-02-06 12:00:00,6
52,"recommendation, similarity, svd, user, oil",2021-02-06 12:00:00,6
53,"emas, pertambangan, gold, penyuluhan, rakyat",2021-02-06 12:00:00,3
54,"algorithm, neighborhood, cvrptw, vns, gvns",2021-02-06 12:00:00,9
55,"tunarungu, deaf, dpc, android, pertuni",2021-02-06 12:00:00,7
56,"tunarungu, drill, deaf, pendingin, ladder",2021-02-06 12:00:00,8
57,"scientific, daftar, oe3c, mendeley, drill",2021-02-06 12:00:00,7
58,"angl, kalbos, science, scientific, jimo",2021-02-06 12:00:00,6
59,"polypropylene, plastic, pyrolysis, density, polyethylene",2021-02-06 12:00:00,1
60,"redfern, coats, combustion, coal, efb",2021-02-06 12:00:00,4
61,"writing, regulated, individual, verbalization, efl",2021-02-06 12:00:00,7
62,"mencatat, inskripsi, luker, partayaj, miracle",2021-02-06 12:00:00,5
63,"households, handbooks, proklim, kpm, pendemi",2021-02-06 12:00:00,4
64,"irrigation, food, pangan, central, water",2021-02-06 12:00:00,6
65,"berpeluang, intrapreneurs, memasuki, cake, pemilik",2021-02-06 12:00:00,4
66,"unbalanced, seedless, nanocolumnars, magnetron, yttria",2021-02-06 12:00:00,2
67,"mandarin, zno, chinese, nanorods, dim",2021-02-06 12:00:00,5
68,"biopharmaca, processed, appropriate, productivity, mandarin",2021-02-06 12:00:00,1
69,"disaster, threats, since, emerge, humanitarian",2021-02-06 12:00:00,3
70,"oxazin, dichlorophenyl, elucidation, 4h, benzo",2021-02-06 12:00:00,1
71,"movement, fitness, physical, motor, games",2021-02-06 12:00:00,10
72,"phosphorus, thulium, tunable, locked, nips3",2021-02-06 12:00:00,2
73,"sangkunur, angkola, ethnoecological, sumatra, north",2021-02-06 12:00:00,1
74,"autism, children, usability, autistic, forest",2021-02-06 12:00:00,10
75,"wormvit, pereda, demam, kunyit, cacing",2021-02-06 12:00:00,1
76,"religious, moderation, processes, qualitative, perspectives",2021-02-06 12:00:00,2
77,"sejarah, merdeka, historical, religious, arcil",2021-02-06 12:00:00,7
78,"mendorong, diamond, cheating, auditor, efisiensi",2021-02-06 12:00:00,2
79,"rambu, temu, perpustakaan, let, read",2021-02-06 12:00:00,3
80,"decline, aksens, encouraging, perpustakaan, ideal",2021-02-06 12:00:00,1
81,"kogntif, thinker, cc, train, ended",2021-02-06 12:00:00,2
82,"wallace, 1859, herpetofauna, bacan, decreasing",2021-02-06 12:00:00,2
83,"batik, motif, payaman, fosil, monokromatik",2021-02-06 12:00:00,5
84,"batik, formed, cold, connection, az31b",2021-02-06 12:00:00,5
85,"lakes, several, bacteria, aerob, kajhu",2021-02-06 12:00:00,5
86,"chitala, scomberomorini, belida, tenggiri, midrib",2021-02-06 12:00:00,2
87,"kewarganegaraan, silica, digital, literasi, hoaks",2021-02-06 12:00:00,8
88,"cp, boost, code, mooc, play",2021-02-06 12:00:00,1
89,"doing, social, motivasi, creators, anonymity",2021-02-06 12:00:00,7
90,"wonderful, midnight, welles, shakespearian, sepenggal",2021-02-06 12:00:00,3
92,"motion, kinematics, dimentional, graphics, straight",2021-02-06 12:00:00,3
93,"penciptaan, naturalistik, seni, lukis, understanding",2021-02-06 12:00:00,7
95,"sembilang, fishermen, tanjung, fishing, households",2021-02-06 12:00:00,2
96,"menopause, kontrasepsi, kehamilan, maternal, wanita",2021-02-06 12:00:00,7
97,"epistemically, restricted, simulations, carlo, monte",2021-02-06 12:00:00,6
98,"companie, intervensi, superior, peranan, insurance",2021-02-06 12:00:00,2
99,"balabolka, lifeskill, multimedia, resources, fitur",2021-02-06 12:00:00,4
100,"kecerdasaan, perwujudan, civic, nilai, quotient",2021-02-06 12:00:00,1
101,"lpc, coworker, preferred, least, reliability",2021-02-06 12:00:00,1
102,"minimization, delay, sugeno, projects, loss",2021-02-06 12:00:00,1
103,"pancasila, economics, discovery, values, module",2021-02-06 12:00:00,2
104,"economics, ternak, jerami, pakan, terapan",2021-02-06 12:00:00,5
105,"ethical, bayu, skak, beat, cadre",2021-02-06 12:00:00,4
106,"moral, counselor, counseling, implications, guidance",2021-02-06 12:00:00,8
107,"counseling, stir, counselor, casting, microstructure",2021-02-06 12:00:00,4
108,"daylight, dialux, evo, gkb, penghematan",2021-02-06 12:00:00,2
109,"perpindahannya, thermodynamics, penyelesaian, tutorial, kalor",2021-02-06 12:00:00,2
110,"dust, marble, filler, concrete, sustainable",2021-02-06 12:00:00,1
111,"ash, fly, agroindustri, liat, kamulan",2021-02-06 12:00:00,5
112,"herb, exoticism, persuasion, esthetic, madurese",2021-02-06 12:00:00,1
113,"clean, ring, matrices, strongly, almost",2021-02-06 12:00:00,6
114,"clean, hospital, ring, taiwan, safety",2021-02-06 12:00:00,5
115,"sensitized, dye, tio2mesoporous, sensitizers, solar",2021-02-06 12:00:00,3
116,"sensitized, dye, solar, wistar, unhidrate",2021-02-06 12:00:00,3
117,"wales, tradisi, sidorejo, ruha, meloan",2021-02-06 12:00:00,3
118,"pull, glued, rod, grain, laminated",2021-02-06 12:00:00,4
119,"bamboo, exercise, laminated, obese, bearing",2021-02-06 12:00:00,6
120,"blended, seeq, learningdengan, sisilengkungkelas, macroeconomics",2021-02-06 12:00:00,6
121,"selenization, cigs, spray, simple, coated",2021-02-06 12:00:00,1
123,"kuwu, bledug, boosting, clay, electrolysis",2021-02-06 12:00:00,2
124,"fibrillation, bacterial, freeze, cellulose, drying",2021-02-06 12:00:00,2
125,"jakarta, transportationpolicyintegration, jabodetabek, commuterline, pedestrian",2021-02-06 12:00:00,2
126,"road, oro, sampah, sapu, saburo",2021-02-06 12:00:00,5
127,"boyolangu, pilot, instalasi, technical, modules",2021-02-06 12:00:00,2
128,"pineapple, made, membrane, bacterial, nanoplatelets",2021-02-06 12:00:00,2
129,"marriage, situbondo, phenomenon, unregistered, sirri",2021-02-06 12:00:00,4
130,"modernisasi, pandemi, pengendalian, digitalisasi, pencegahan",2021-02-06 12:00:00,4
131,"topical, lipoteichoic, lta, olive, virgin",2021-02-06 12:00:00,2
132,"kit, build, concept, extension, association",2021-02-06 12:00:00,4
133,"fashion, busana, map, concept, build",2021-02-06 12:00:00,5
134,"concrete, beams, graded, fashion, strength",2021-02-06 12:00:00,4
136,"quizizz, confidence, informatics, sets, gamification",2021-02-06 12:00:00,2
137,"blindness, alien, invasive, plants, plant",2021-02-06 12:00:00,1
138,"65, diabetes, decarboxylase, immunochromatography, glutamic",2021-02-06 12:00:00,4
139,"poliklinik, civitas, akademika, pelayanan, um",2021-02-06 12:00:00,1
140,"smoking, cigarette, satisfaction, entre, tobacco",2021-02-06 12:00:00,7
141,"emotion, detection, nfc, accessing, text",2021-02-06 12:00:00,4
142,"eskalasi, sumberdem, sbi, incubator, halal",2021-02-06 12:00:00,2
143,"authentication, verifiable, integrity, halal, device",2021-02-06 12:00:00,1
144,"diagnose, isomorphic, items, force, choice",2021-02-06 12:00:00,1
145,"zurich, april, sunspot, february, flare",2021-02-06 12:00:00,1
146,"highlighting, negotiated, expanded, language, second",2021-02-06 12:00:00,3
147,"diesel, emisi, buang, gas, exhaust",2021-02-06 12:00:00,2
148,"konsumtif, rasionalitas, teman, sebaya, ekonomi",2021-02-06 12:00:00,1
149,"pangasius, djambal, lymphocyte, tooth, hfd",2021-02-06 12:00:00,2
