topic,topic_words,tahun,count
254,"involved, biosynthesis, starch, padi, gbssi",2017-03-15 00:00:00,5
256,"concentrated, inhibitive, 304ss, hcl, psidium",2017-03-15 00:00:00,1
258,"salmon, optimal, tracking, migration, wheeling",2017-03-15 00:00:00,7
260,"cytotoxic, irradiation, uv, breast, vitro",2017-03-15 00:00:00,1
262,"articulate, storyline, penjernih, pinneapple, essence",2017-03-15 00:00:00,2
263,"optik, skkni, teoritis, dudi, organik",2017-03-15 00:00:00,3
264,"prinsipal, political, pressure, organizational, change",2017-03-15 00:00:00,1
266,"picture, takwa, bogor, fabel, insan",2017-03-15 00:00:00,1
268,"kubah, dekorasi, hidayah, ornamen, masjid",2017-03-15 00:00:00,1
269,"rele, cibatu, gecobridge, gardu, induk",2017-03-15 00:00:00,2
270,"pernapasan, karangan, semester, trenggalek, manusia",2017-03-15 00:00:00,1
271,"uniqueness, valued, completion, metric, spaces",2017-03-15 00:00:00,1
272,"erythrocyte, oxidative, continuous, enzyme, spaces",2017-03-15 00:00:00,1
275,"c4, classifiers, capabilities, dataset, naive",2017-03-15 00:00:00,2
276,"wartawan, journalists, jurnalisme, jurnalistik, otonomi",2017-03-15 00:00:00,2
282,"ti6al4v, implants, knee, made, miniplate",2017-03-15 00:00:00,3
285,"terpadu, tema, tematik, bank, fisik",2017-03-15 00:00:00,2
286,"exteriorize, funds, accountability, village, tutorial",2017-03-15 00:00:00,2
288,"spasial, kecerdasan, kemandirian, gambar, visual",2017-03-15 00:00:00,1
289,"expressionless, kills, my, me, geogebra",2017-03-15 00:00:00,1
291,"proyeksi, arsitektur, animasi, kuliah, komunikasi",2017-03-15 00:00:00,1
295,"plga, eluting, drug, release, scaffolds",2017-03-15 00:00:00,1
296,"seksual, proteksi, my, guide, kekerasan",2017-03-15 00:00:00,1
0,"mathematical, mathematics, solving, problems, problem",2018-07-02 20:00:00,109
1,"mathematical, solving, mathematics, indonesian, problems",2018-07-02 20:00:00,21
2,"power, grid, captive, methode, transmission",2018-07-02 20:00:00,30
3,"tourism, power, sabung, hotel, mitigation",2018-07-02 20:00:00,20
4,"chemistry, tourism, chemical, laboratorium, forces",2018-07-02 20:00:00,12
5,"earthcomm, environmental, worldview, chemistry, lingkungan",2018-07-02 20:00:00,15
6,"inf, environmental, magnetic, ferrofluids, fe3",2018-07-02 20:00:00,27
7,"entrepreneurship, entrepreneurial, inf, magnetic, weakness",2018-07-02 20:00:00,22
9,"industrial, pandemic, covid, 19, vocational",2018-07-02 20:00:00,27
10,"biology, vocational, biologi, skills, outcome",2018-07-02 20:00:00,18
11,"biology, drinks, carica, papaya, leaves",2018-07-02 20:00:00,14
12,"troso, consumer, loyalty, familiarity, commerce",2018-07-02 20:00:00,15
13,"instructor, reading, bbq, enhances, 39",2018-07-02 20:00:00,12
14,"mobile, reading, android, app, fsa",2018-07-02 20:00:00,12
15,"maksimal, android, nutritional, vo2max, mobile",2018-07-02 20:00:00,7
16,"islamic, boarding, islam, kemuhammadiyahan, watan",2018-07-02 20:00:00,13
17,"continuous, tenable, teachersvoices, underst, continuing",2018-07-02 20:00:00,7
18,"keluarga, tk, selektif, hayat, mutisme",2018-07-02 20:00:00,8
19,"kepemimpinan, leadership, kepala, visioner, parenting",2018-07-02 20:00:00,20
20,"commitment, employee, leadership, kepemimpinan, organizational",2018-07-02 20:00:00,7
21,"game, parikan, paribasan, modification, kar",2018-07-02 20:00:00,9
22,"robot, game, object, omnidirectional, robotic",2018-07-02 20:00:00,13
23,"augmented, reality, grinding, forms, robot",2018-07-02 20:00:00,9
24,"augmented, reality, online, massive, analytics",2018-07-02 20:00:00,11
25,"olahraga, jasmani, kesehatan, online, sulistiyorini",2018-07-02 20:00:00,8
26,"karakter, penguatan, pendidikan, olahraga, pembinaan",2018-07-02 20:00:00,11
27,"unicyclic, magic, graph, labeling, ramsey",2018-07-02 20:00:00,5
28,"graphs, stereotypes, sendiri, outlook, graph",2018-07-02 20:00:00,9
29,"arab, tasyriyyah, gender, bahasa, women",2018-07-02 20:00:00,8
31,"geography, spatial, imindmap, earthcomm, gis",2018-07-02 20:00:00,6
32,"geography, meramalkan, penutupan, stochastic, geografi",2018-07-02 20:00:00,7
33,"akuntansi, accounting, late, pencatatan, concerns",2018-07-02 20:00:00,8
34,"akuntansi, accounting, oligomerization, benzene, carrageenan",2018-07-02 20:00:00,11
35,"critical, ricosre, quantive, abilities, thinking",2018-07-02 20:00:00,9
36,"critical, der, thinking, die, von",2018-07-02 20:00:00,10
37,"gradual, inclusive, counsellors, jerman, eastern",2018-07-02 20:00:00,6
38,"tandur, objectives, koherensi, pembagian, ease",2018-07-02 20:00:00,4
39,"fisika, autarkeia, history, physics, jenggawah",2018-07-02 20:00:00,9
40,"wealth, net, inequality, rental, dagum",2018-07-02 20:00:00,5
41,"most, mechanical, important, engineering, project",2018-07-02 20:00:00,6
42,"makerspace, filing, constructivist, disruptive, edmodo",2018-07-02 20:00:00,6
43,"asses, supplemented, empower, pbl, explain",2018-07-02 20:00:00,4
44,"edupoint, broadcasting, promotion, problem, kanak",2018-07-02 20:00:00,9
45,"cacl2, electrofreezing, nucleation, 6h2o, supercooling",2018-07-02 20:00:00,6
46,"kesehatan, germas, ragaencourage, bta, premi",2018-07-02 20:00:00,5
47,"semiology, barthesian, financial, myth, finansial",2018-07-02 20:00:00,3
48,"fluida, statis, supplemented, penguasaan, financial",2018-07-02 20:00:00,4
49,"islam, barat, formal, profetik, evolusi",2018-07-02 20:00:00,4
50,"jigsaw, cocoper, remad, focus, discussion",2018-07-02 20:00:00,4
51,"crude, heterogeneous, cao, palm, biodiesel",2018-07-02 20:00:00,1
52,"classification, oil, means, clustering, nearest",2018-07-02 20:00:00,14
53,"gulf, prigi, isotopes, means, anthropogenic",2018-07-02 20:00:00,8
54,"sequential, surrogate, evolutionary, vnd, lqi",2018-07-02 20:00:00,6
55,"hearing, qur, fluency, impairments, accelerating",2018-07-02 20:00:00,7
56,"drill, softball, peningkkatan, kedeng, sepaktakraw",2018-07-02 20:00:00,2
57,"solubility, prior, practicum, survey, experience",2018-07-02 20:00:00,3
58,"clil, predictors, lower, inggris, vocabulary",2018-07-02 20:00:00,3
59,"english, tensile, polyester, resin, mercerization",2018-07-02 20:00:00,7
60,"thermogravimetric, spirulina, platensis, mgco3, marine",2018-07-02 20:00:00,2
61,"writing, confronting, subtext, pagerank, blog",2018-07-02 20:00:00,4
62,"pergelaran, pelaut, benua, kehebatan, writing",2018-07-02 20:00:00,4
63,"makanan, dago, masakan, malioboro, haccp",2018-07-02 20:00:00,4
64,"drainage, dobo, aru, steady, islands",2018-07-02 20:00:00,9
65,"ebl, berbudaya, technopreneur, ready, has",2018-07-02 20:00:00,5
66,"cass, biofoam, grown, substrate, photoelectrochemical",2018-07-02 20:00:00,2
67,"youxi, shenghuo, mandarin, jendela, hsk",2018-07-02 20:00:00,2
68,"mandarin, chanos, scales, collagen, milky",2018-07-02 20:00:00,7
69,"disaster, taxonomy, textbook, evaluating, questions",2018-07-02 20:00:00,5
70,"disaster, inflammatory, trail, betel, rheumatoid",2018-07-02 20:00:00,7
71,"traffic, play, surfaceplay, prosocial, simulation",2018-07-02 20:00:00,2
73,"fiber, laser, mode, wisdom, locked",2018-07-02 20:00:00,12
74,"autis, orangtua, autism, pecs, schedule",2018-07-02 20:00:00,6
75,"fungi, histologic, endophytic, metabolites, observation",2018-07-02 20:00:00,3
76,"faith, disengagement, rationalization, radicalisation, religius",2018-07-02 20:00:00,4
77,"sejarah, outdoor, religious, alun, situs",2018-07-02 20:00:00,9
78,"fraud, whistleblowing, sejarah, adn, kecurangan",2018-07-02 20:00:00,6
79,"perpustakaan, audit, fraud, mendukung, library",2018-07-02 20:00:00,9
81,"creative, pengambilan, keputusan, lear, kemanjuran",2018-07-02 20:00:00,9
82,"creative, characteristic, heights, differenet, bartelsi",2018-07-02 20:00:00,4
83,"batik, motif, mengandung, banyuwangis, makers",2018-07-02 20:00:00,3
84,"batik, ductile, austempering, tensile, motif",2018-07-02 20:00:00,7
85,"bacteria, indigene, ureolytic, urec, encoded",2018-07-02 20:00:00,3
86,"silica, spectroscopy, biomaterials, brief, studied",2018-07-02 20:00:00,6
87,"berinternet, european, perempuan, berkarya, democratic",2018-07-02 20:00:00,4
88,"keikutsertaan, berprestasi, keefektifan, pertama, kegiatan",2018-07-02 20:00:00,2
89,"utillization, facebook, multilingual, whatsapp, social",2018-07-02 20:00:00,3
90,"ande, reenacting, anthology, builder, kaji",2018-07-02 20:00:00,3
91,"exigua, bulbs, pests, onion, portable",2018-07-02 20:00:00,4
92,"straight, motion, instruction, sulitkah, line",2018-07-02 20:00:00,6
93,"kenusantaraan, destruction, cipta, artistik, kriya",2018-07-02 20:00:00,2
94,"ferrofluids, sub, inf, antibacterial, 4000",2018-07-02 20:00:00,8
95,"catfish, growing, farming, pond, fish",2018-07-02 20:00:00,1
96,"gonadotropic, alleviate, nifas, propolis, reproductive",2018-07-02 20:00:00,3
97,"adsorptivitas, adsorben, acrylic, permukaan, partikel",2018-07-02 20:00:00,2
98,"measurement, bank, reviewed, thought, mudah",2018-07-02 20:00:00,3
99,"guling, multimedia, sumberpucung, lantai, belakang",2018-07-02 20:00:00,3
100,"multimedia, negara, antisipasi, mendatang, meneguhkan",2018-07-02 20:00:00,3
101,"objectivity, authentic, appraisal, assessment, plan",2018-07-02 20:00:00,3
102,"fuzzy, logic, brooder, forecasting, nfs",2018-07-02 20:00:00,6
103,"macroeconomics, pluralism, scenario, medan, fuzzy",2018-07-02 20:00:00,2
104,"sapi, economics, manufacturer, lumbricus, proper",2018-07-02 20:00:00,3
105,"moral, konselor, komik, memfasilitasi, perkembangan",2018-07-02 20:00:00,3
106,"moral, counseling, santris, progressif, helper",2018-07-02 20:00:00,6
107,"casting, counseling, binders, cryogenic, rheo",2018-07-02 20:00:00,3
108,"idb, funded, building, measures, shading",2018-07-02 20:00:00,3
109,"kalor, suhu, recitation, thermodynamics, fenomena",2018-07-02 20:00:00,4
110,"mortars, lenturan, geoplimer, berlubang, kalor",2018-07-02 20:00:00,3
111,"develeopment, klaten, agrarian, farmer, contemporary",2018-07-02 20:00:00,2
112,"plants, medicinal, dayak, luak, genik",2018-07-02 20:00:00,3
113,"clean, ring, nil, cleanness, medicinal",2018-07-02 20:00:00,9
114,"rooms, paramedic, equity, inpatient, clean",2018-07-02 20:00:00,2
115,"clathrin, sensitized, dye, dssc, cell",2018-07-02 20:00:00,4
116,"sensitized, dye, solar, insulin, streptozotocin",2018-07-02 20:00:00,5
117,"seblang, ceremony, meanings, aesthetic, forms",2018-07-02 20:00:00,1
118,"bamboo, sidewall, flexure, stirrups, confinements",2018-07-02 20:00:00,3
119,"melatonin, hormon, puasa, jantan, wistar",2018-07-02 20:00:00,1
120,"berpengaruh, faktor, blended, training, object",2018-07-02 20:00:00,2
121,"blended, cu2o, fto, sno2, immersion",2018-07-02 20:00:00,4
123,"microscopy, nanostructured, diffraction, electron, situ",2018-07-02 20:00:00,1
124,"stirring, duration, photocatalytic, hardness, glycol",2018-07-02 20:00:00,5
125,"road, priority, maintenance, bacterial, bureaucracy",2018-07-02 20:00:00,4
126,"tpst, bersatu, 3r, penampungan, recycle",2018-07-02 20:00:00,1
127,"elektro, s1, tranduser, teknik, telecommunication",2018-07-02 20:00:00,4
128,"starch, nanoclay, biocomposite, crystallinity, nanocellulose",2018-07-02 20:00:00,8
131,"pandemi, aureus, acids, staphylococcus, antibacterial",2018-07-02 20:00:00,7
132,"meaningful, map, reconstruction, improvable, cbl",2018-07-02 20:00:00,4
133,"grading, fashion, map, concept, adobe",2018-07-02 20:00:00,5
134,"functionally, graded, concrete, fashion, layers",2018-07-02 20:00:00,4
135,"graded, concrete, beams, undang, kebudayaan",2018-07-02 20:00:00,7
136,"styles, primary, environment, conceptual, effects",2018-07-02 20:00:00,1
137,"popular, practicality, survival, validity, plants",2018-07-02 20:00:00,2
138,"diabetes, mellitus, plant, melitus, tipe",2018-07-02 20:00:00,5
140,"cessation, alteration, tobacco, religiosity, smoking",2018-07-02 20:00:00,2
141,"smoking, face, commuter, transjakarta, bayes",2018-07-02 20:00:00,5
142,"sertifikasi, jaminan, halal, produk, ukm",2018-07-02 20:00:00,3
143,"halal, monitoring, iot, audits, energy",2018-07-02 20:00:00,5
144,"mengukur, choice, kalor, suhu, tier",2018-07-02 20:00:00,1
145,"neutron, perfect, anisotropic, stars, instrumen",2018-07-02 20:00:00,5
146,"exploiting, corpora, third, purposes, pedagogical",2018-07-02 20:00:00,1
147,"exhaust, ron, 1pa, fueled, yamaha",2018-07-02 20:00:00,2
148,"menabung, modernitas, saku, individu, uang",2018-07-02 20:00:00,1
149,"garlic, bulb, hematology, konsumsi, mice",2018-07-02 20:00:00,4
150,"responsibility, corporate, menyusuri, meraih, pertambangan",2018-07-02 20:00:00,3
151,"eggshell, cao, responsibility, corporate, caco",2018-07-02 20:00:00,6
152,"nozzle, floating, blade, wheel, turbine",2018-07-02 20:00:00,4
153,"sepakbola, latihan, turbine, iguana, kicker",2018-07-02 20:00:00,3
154,"betatrophin, metabolic, syndrome, sepakbola, colorectal",2018-07-02 20:00:00,7
155,"asphalt, wearing, crumb, tire, motorcycle",2018-07-02 20:00:00,2
156,"video, kepenyiaran, asphalt, renang, televisi",2018-07-02 20:00:00,3
157,"psikoedukasi, video, dislexia, komunikasi, gugus",2018-07-02 20:00:00,3
158,"persistence, depan, perguruan, year, first",2018-07-02 20:00:00,2
159,"siloxane, imidazoline, functionalized, quasi, route",2018-07-02 20:00:00,1
160,"supervision, clinical, managerial, methodology, ethics",2018-07-02 20:00:00,3
162,"penulisan, ilmiah, convolution, sleepiness, averaging",2018-07-02 20:00:00,3
163,"abili, parisudha, kaya, integrates, emulation",2018-07-02 20:00:00,2
164,"scaffolding, delaying, draw, geogebra, project",2018-07-02 20:00:00,7
165,"layers, fractions, conceptual, elementary, among",2018-07-02 20:00:00,1
166,"skewness, driver, predictive, pendukung, pemilihan",2018-07-02 20:00:00,2
167,"constructive, alignment, look, intervention, written",2018-07-02 20:00:00,2
168,"srengat, tournament, bolabasket, teams, 2018",2018-07-02 20:00:00,1
170,"life, contructing, democracy, berpendekatan, mooc",2018-07-02 20:00:00,3
172,"pekalongan, memupuk, produktifitas, difabel, cluster",2018-07-02 20:00:00,3
173,"svm, articles, technological, calon, tpack",2018-07-02 20:00:00,2
174,"landslide, lsm, pedagogical, imagery, technological",2018-07-02 20:00:00,2
175,"piring, figurative, pigments, landslide, themed",2018-07-02 20:00:00,3
177,"pinjaman, lendingclub, lending, peer, fakto",2018-07-02 20:00:00,2
178,"comic, manners, internalize, proverbs, seventh",2018-07-02 20:00:00,3
179,"vlc, laboratory, um, machine, intelligence",2018-07-02 20:00:00,1
181,"filsafat, typhi, siomay, antifertilitas, kecambah",2018-07-02 20:00:00,3
182,"komparasi, newton, calon, hukum, penguasaan",2018-07-02 20:00:00,1
183,"newton, prone, kelud, volcanic, hazard",2018-07-02 20:00:00,2
185,"makan, siswi, full, day, gizi",2018-07-02 20:00:00,1
186,"perovskite, cell, solar, obesitas, photoanode",2018-07-02 20:00:00,11
187,"dc, efficiency, ac, grid, comparison",2018-07-02 20:00:00,1
188,"yearschildren, parentsreligiosity, immunization, makers, complete",2018-07-02 20:00:00,1
189,"soils, orchards, peh, pulo, magnetic",2018-07-02 20:00:00,4
190,"equipment, nox, toll, susceptibility, magnetic",2018-07-02 20:00:00,4
191,"magnetite, toxicity, sized, polyaniline, dioxide",2018-07-02 20:00:00,2
192,"wind, turbine, savonius, speed, vertical",2018-07-02 20:00:00,7
194,"difference, civic, conventional, strategy, silver",2018-07-02 20:00:00,1
195,"instagram, instastory, pemberdaya, critical, implemented",2018-07-02 20:00:00,4
196,"instagram, finite, element, cracks, axle",2018-07-02 20:00:00,7
197,"bullying, karpman, segitiga, kalangan, perilaku",2018-07-02 20:00:00,2
198,"syntactic, bullying, debate, l2, determination",2018-07-02 20:00:00,2
199,"hyperlipidemia, speaking, uses, garlic, inhibitory",2018-07-02 20:00:00,4
200,"heat, transfer, nanofluid, garlic, exchanger",2018-07-02 20:00:00,7
201,"beraktivitas, bantur, sampai, heat, dataran",2018-07-02 20:00:00,1
202,"update, cloves, aromaticum, maluku, syzygium",2018-07-02 20:00:00,1
204,"al, science, wa, socio, issues",2018-07-02 20:00:00,2
205,"kesantunan, al, liberalisme, mengawal, kekinian",2018-07-02 20:00:00,4
207,"aset, penaksiran, occupancy, schooling, neg",2018-07-02 20:00:00,3
208,"bina, berkebutuhan, inklusi, khusus, diri",2018-07-02 20:00:00,1
209,"inklusi, aquifers, cemung, gedangan, schlumberger",2018-07-02 20:00:00,2
210,"absorbers, bafe12o19, bafe10cozno19, permittivity, microwave",2018-07-02 20:00:00,2
211,"glycine, soybean, microwave, max, merill",2018-07-02 20:00:00,5
212,"soybean, good, governance, berjaringan, reach",2018-07-02 20:00:00,3
213,"culturally, responsive, tradition, crtm, kasada",2018-07-02 20:00:00,4
214,"melon, nata, penyuluhan, booklet, petani",2018-07-02 20:00:00,1
215,"qhbm, queen, alone, mppt, stand",2018-07-02 20:00:00,1
216,"viewing, extensive, elt, listening, bee",2018-07-02 20:00:00,1
217,"listening, pneuonia, innate, macrophages, immune",2018-07-02 20:00:00,2
219,"pemeluk, memupuk, gereja, beragama, kader",2018-07-02 20:00:00,3
220,"batteries, lithium, cathode, ion, linipo4",2018-07-02 20:00:00,4
222,"coping, kombatan, virtual, gam, stress",2018-07-02 20:00:00,3
223,"scien, share, pair, think, combined",2018-07-02 20:00:00,1
225,"mechanisms, thunderstorm, applied, dispat, transformation",2018-07-02 20:00:00,2
226,"thunderstorm, stimulate, song, videos, kindergarten",2018-07-02 20:00:00,3
229,"anthropometry, infants, dengue, status, calculating",2018-07-02 20:00:00,2
230,"tandem, help, distance, does, how",2018-07-02 20:00:00,1
231,"segregation, suburb, sprawl, western, residential",2018-07-02 20:00:00,1
233,"resilience, bimetal, colocasia, hexamethyldisiloxane, superhydrophobic",2018-07-02 20:00:00,3
234,"overhang, fdm, printing, usage, characteristic",2018-07-02 20:00:00,1
236,"coastal, mangrove, coffeerove, karawang, keselamatan",2018-07-02 20:00:00,3
237,"labor, market, relevance, examining, graduates",2018-07-02 20:00:00,2
238,"sipejar, mode, perception, blended, project",2018-07-02 20:00:00,1
239,"counsellor, goal, mindfulness, religiosity, pjbl",2018-07-02 20:00:00,1
241,"quizizz, mekanik, gelombang, aplikasi, pemahaman",2018-07-02 20:00:00,1
242,"exemplar, context, perspective, writing, higher",2018-07-02 20:00:00,1
245,"microstrip, antennas, patches, cp, triangular",2018-07-02 20:00:00,2
246,"finansial, migran, pekerja, keluarga, latar",2018-07-02 20:00:00,2
247,"tengger, around, bromo, semeru, dicranopteris",2018-07-02 20:00:00,3
248,"vhi, drought, river, kuin, vegetation",2018-07-02 20:00:00,2
249,"breastfeeding, cessation, survival, exclusive, related",2018-07-02 20:00:00,1
253,"fires, park, baluran, soil, crater",2018-07-02 20:00:00,3
256,"honeycomb, sulfuric, 304, inhibition, stainless",2018-07-02 20:00:00,1
258,"salmon, transaction, balance, link, obstacles",2018-07-02 20:00:00,4
259,"bulutangki, gymnastics, salmon, pemula, atlet",2018-07-02 20:00:00,3
260,"medicinal, cancer, silico, plants, anti",2018-07-02 20:00:00,1
263,"optik, geometri, saintifik, literasi, sma",2018-07-02 20:00:00,1
265,"tax, amnesty, period, leadership, pajak",2018-07-02 20:00:00,4
268,"tradition, jatirogo, drosophila, melanogaster, elites",2018-07-02 20:00:00,1
272,"thermogenesis, caloric, submaximal, linked, acute",2018-07-02 20:00:00,1
276,"citizen, suryas, existensialism, reporter, page",2018-07-02 20:00:00,1
278,"moodle, aids, hiv, questionnaire, prevention",2018-07-02 20:00:00,2
280,"markasan, selling, best, music, strategy",2018-07-02 20:00:00,1
282,"surgery, pelvic, bending, implant, alloy",2018-07-02 20:00:00,1
286,"kobonduren, bebek, tematik, iptek, dasar",2018-07-02 20:00:00,2
290,"cafe, bersih, sehat, menuju, german",2018-07-02 20:00:00,1
291,"wahid, hasyim, peredaran, darah, bahasan",2018-07-02 20:00:00,1
292,"ganjil, tosari, pandawa, pasraman, sedaeng",2018-07-02 20:00:00,2
294,"flash, intrapersonal, marah, pakar, sederajat",2018-07-02 20:00:00,3
0,"solving, mathematical, problems, mathematics, menyelesaikan",2019-10-20 16:00:00,178
1,"indonesian, mathematical, language, solving, problems",2019-10-20 16:00:00,75
2,"power, indonesian, harmonic, detuned, shunt",2019-10-20 16:00:00,78
3,"tourism, power, wisata, voltage, pariwisata",2019-10-20 16:00:00,111
4,"chemistry, tourism, kimia, chemical, wisata",2019-10-20 16:00:00,96
5,"chemistry, environmental, kimia, chemical, literacy",2019-10-20 16:00:00,83
6,"environmental, magnetic, sub, nanoparticles, lingkungan",2019-10-20 16:00:00,39
7,"entrepreneurial, entrepreneurship, intention, inf, magnetic",2019-10-20 16:00:00,64
8,"entrepreneurial, entrepreneurship, 19, covid, pandemi",2019-10-20 16:00:00,95
9,"pandemic, covid, 19, during, industri",2019-10-20 16:00:00,53
10,"biology, skills, vocational, industri, randai",2019-10-20 16:00:00,59
11,"biology, biologi, skills, critical, thinking",2019-10-20 16:00:00,57
12,"pemasaran, marketing, brand, branding, commerce",2019-10-20 16:00:00,69
13,"reading, brand, literasi, comprehension, baca",2019-10-20 16:00:00,49
14,"android, reading, mobile, membaca, comprehension",2019-10-20 16:00:00,73
15,"android, mobile, atlet, otot, survei",2019-10-20 16:00:00,58
16,"islamic, islam, agama, athletes, atlet",2019-10-20 16:00:00,41
17,"islamic, islam, guru, boarding, professional",2019-10-20 16:00:00,43
18,"guru, parenting, anak, professional, tua",2019-10-20 16:00:00,49
19,"leadership, principal, kepemimpinan, kepala, parenting",2019-10-20 16:00:00,33
20,"kepemimpinan, leadership, employee, kepala, organizational",2019-10-20 16:00:00,35
21,"game, organizational, karyawan, permainan, employee",2019-10-20 16:00:00,54
22,"robot, game, permainan, control, command",2019-10-20 16:00:00,21
23,"augmented, reality, robot, 3d, mobile",2019-10-20 16:00:00,53
24,"augmented, reality, online, learning, web",2019-10-20 16:00:00,48
25,"olahraga, online, jasmani, kesehatan, survei",2019-10-20 16:00:00,37
26,"character, olahraga, karakter, sports, jasmani",2019-10-20 16:00:00,33
27,"graphs, minimal, ramsey, karakter, character",2019-10-20 16:00:00,39
28,"graphs, graph, gender, ramsey, minimal",2019-10-20 16:00:00,34
29,"arabic, arab, gender, women, perempuan",2019-10-20 16:00:00,48
30,"aluminophosphate, chloride, arabic, arab, diamine",2019-10-20 16:00:00,5
31,"geografi, geography, spbl, spatial, silver",2019-10-20 16:00:00,32
32,"geography, geografi, capital, spatial, stock",2019-10-20 16:00:00,28
33,"accounting, akuntansi, perusahaan, saham, return",2019-10-20 16:00:00,41
34,"akuntansi, accounting, catalyst, lime, lemon",2019-10-20 16:00:00,21
35,"critical, thinking, skills, calculus, reaction",2019-10-20 16:00:00,32
36,"critical, jerman, thinking, german, skills",2019-10-20 16:00:00,23
37,"jerman, inclusive, teacher, german, attitudes",2019-10-20 16:00:00,25
38,"physics, inclusive, representations, lecture, teachers",2019-10-20 16:00:00,16
39,"fisika, physics, democracy, autonomy, padat",2019-10-20 16:00:00,25
40,"durbin, inequality, indonesia, investment, exports",2019-10-20 16:00:00,26
41,"bangunan, teknik, inequality, konstruksi, interior",2019-10-20 16:00:00,22
42,"bangunan, engineering, teknik, collab, keahlian",2019-10-20 16:00:00,31
43,"problem, solving, learning, based, explain",2019-10-20 16:00:00,29
44,"problem, media, solving, pembelajaran, learning",2019-10-20 16:00:00,33
45,"symmetric, znonr, foil, fc, aluminum",2019-10-20 16:00:00,15
46,"kesehatan, supercapacitor, clinic, supercapacitors, health",2019-10-20 16:00:00,28
47,"financial, kesehatan, keuangan, medical, health",2019-10-20 16:00:00,24
48,"financial, fluid, fluida, static, statis",2019-10-20 16:00:00,34
49,"fluid, static, fluida, islam, statis",2019-10-20 16:00:00,25
50,"islam, kooperatif, auditory, jigsaw, somatic",2019-10-20 16:00:00,18
51,"oil, biodiesel, kooperatif, palm, k2o",2019-10-20 16:00:00,21
52,"clustering, oil, upcsim, recommendation, biodiesel",2019-10-20 16:00:00,14
53,"means, clustering, classification, sediment, recommendation",2019-10-20 16:00:00,23
54,"perturbation, yield, routing, sediment, programnya",2019-10-20 16:00:00,11
55,"tunarungu, deaf, isyarat, algorithm, bisindo",2019-10-20 16:00:00,17
56,"drill, tunarungu, deaf, bulutangkis, pukulan",2019-10-20 16:00:00,30
57,"science, scientific, drill, inquiry, latihan",2019-10-20 16:00:00,30
58,"english, science, scientific, communicate, willingness",2019-10-20 16:00:00,15
59,"english, aspal, campuran, plastik, retardant",2019-10-20 16:00:00,9
60,"combustion, kinetic, thermogravimetric, fiber, microalgae",2019-10-20 16:00:00,14
61,"writing, combustion, platensis, efl, microalgae",2019-10-20 16:00:00,17
62,"writing, jawar, sajak, candi, tomat",2019-10-20 16:00:00,17
63,"food, pangan, candi, relief, sholihul",2019-10-20 16:00:00,21
64,"pangan, food, lestari, air, debit",2019-10-20 16:00:00,19
65,"buginese, sukses, berkah, kewirausahaan, enterpreneurship",2019-10-20 16:00:00,21
66,"nanorods, adding, zno, nanogenerator, triboelectric",2019-10-20 16:00:00,12
67,"mandarin, zno, nanorods, chinese, bahasa",2019-10-20 16:00:00,29
68,"mandarin, bahasa, chinese, bacillus, protease",2019-10-20 16:00:00,15
69,"disaster, preparedness, bencana, bacillus, tsunami",2019-10-20 16:00:00,23
70,"disaster, preparedness, betel, crocatum, piper",2019-10-20 16:00:00,21
71,"motorik, kasar, motor, betel, crocatum",2019-10-20 16:00:00,24
73,"fiber, laser, mode, locked, doped",2019-10-20 16:00:00,13
74,"autism, autisme, disorder, autistic, forest",2019-10-20 16:00:00,11
75,"autism, endophytic, cinchona, disorder, spectrum",2019-10-20 16:00:00,12
76,"endophytic, religious, religius, fungi, radicalism",2019-10-20 16:00:00,20
77,"museum, religious, historical, history, sites",2019-10-20 16:00:00,11
78,"audit, sejarah, fraud, teknologi, historical",2019-10-20 16:00:00,32
79,"perpustakaan, audit, fraud, informasi, library",2019-10-20 16:00:00,20
80,"perpustakaan, depresi, library, depressive, mental",2019-10-20 16:00:00,14
81,"creative, thinking, kreatif, mental, berpikir",2019-10-20 16:00:00,17
82,"creative, kreatif, thinking, berpikir, diversity",2019-10-20 16:00:00,20
83,"batik, motif, eagle, frog, ecoprint",2019-10-20 16:00:00,26
84,"batik, motif, welding, baja, steel",2019-10-20 16:00:00,13
85,"bacteria, indigenous, steel, lakes, welding",2019-10-20 16:00:00,12
